### ISSUE TITLE
Proxy doesn't work.

### ISSUE THREAD

**Issue by Spencerh20** [yadayada/acd_cli#320]
My server has a problem with the routing to the US  so downloading files from ACD can take very long time sometimes.
So I wanna use a proxy to solve this problem but it doesn't work.
That's what I did :
`$HTTPS_PROXY="http://USERNAME:PW@5.175.207.100:80" acd_cli sync
Getting changes..
Inserting nodes.
`
`tcpdump -i eth0 host 5.175.207.100`
Tcpdump shows traffic over the IP 5.175.207.100
`23:48:43.517009 IP SERVER > 5.175.207.100.http: Flags [.], ack 3684, win 319, options [nop,nop,TS val 155039860 ecr 341851317], length 0`and so on
So I started a download and that's what tcpdump shows
`
00:00:04.674534 IP SERVERADDRESS.47288 > ec2-52-5-29-11.compute-1.amazonaws.com.https: tcp 0
00:00:04.674639 IP ec2-52-5-29-11.compute-1.amazonaws.com.https > SERVERADDRESS.47288: tcp 1448
00:00:04.674757 IP ec2-52-5-29-11.compute-1.amazonaws.com.https > SERVERADDRESS.47288: tcp 1448
`
When I type in `tcpdump -i eth0 host 5.175.207.100` again there weren't any connections.
So the proxy does only work during `acd_cli sync` and not for downloads.How can I fix this?

**Comment by msh100** [comment]
Drop the `$`,

```
HTTPS_PROXY="http://USERNAME:PW@5.175.207.100:80" acd_cli sync 
```

should be enough

**Comment by Spencerh20** [comment]
Same.

**Comment by Spencerh20** [comment]
![snag-0385](https://cloud.githubusercontent.com/assets/18602926/14969821/c4078006-10c4-11e6-9d42-0ac39847e519.jpg)
Just AWS connections.No proxy.

**Comment by Spencerh20** [comment]
Restarted server and it works now.

**Comment by Spencerh20** [comment]
How can I disable the proxy?

**Comment by msh100** [comment]
Unset the environment variable (and remount if necessary)
